Mother Teresa World School,"663, Ognej Circle, Vadsar, Sarkhej Gandhinagar Highway, Ahmedabad - 380055, Near Airforce Station",+(91)-79-30925850,http://www.motherteresaschools.in,2012,4.2,"Schools , Boarding Schools"
Angel School,"100/1, Naresh Building, Maninagar, Ahmedabad - 380008, Opposite L G Hospital",+(91)-79-30932969,http://www.angelschool.co.in,1982,4.3,"Schools , English Medium Schools , Playgroups , Day Care Centres , Gujarati Medium Schools , Summer Camps , International Schools , Gseb Schools , Nursery Schools , Kindergartens , IGCSE Schools , Yoga Teacher Training Institutes , Teacher Training Institutes , Schools For Higher Secondary , Public Schools , Schools Nursery To X , Schools Nursery To VII"
R P Vasani International School,"Nikol Naroda Road, Nava Naroda, Ahmedabad - 382330, Behind Radheshyam Residency, Near Suyog 99, Oppo...",+(91)-79-33014932,http://www.rpvis.org,2014,4.3,"CBSE Schools , Schools , English Medium Schools , Nursery Schools , Kindergartens"
Bright School,"Mangal Vidyalay School Campus, Ellis Bridge, Ahmedabad - 380006, Near Mithakhali Bus Stop",+(91)-79-30491971,http://www.brightschool.in,,3.6,"Schools , Playgroups , English Medium Schools , Day Care Centres , Kindergartens , Nursery Schools"
Euro Kids,"14, Dungarshree Nagar 1, Anjali Cross Road, Paldi, Ahmedabad - 380007, Near Sheth Hospital",+(91)-79-30495454,,2002,4.0,"Schools , Playgroups , Kindergartens , Nursery Schools"
Earth School,"Ioc Road, Chandkheda, Ahmedabad - 382424, Behind Satyamev Hospital, Opposite Aaradhya Home, Jundal, ...",+(91)-79-33021223,,2015,3.5,"Schools , English Medium Schools , Playgroups , Gujarati Medium Schools , Kindergartens"
Anand Niketan School,"Plot No 495, Thaltej Shilaj Road, Opposite Aryaman Bungalow, Shilaj, Ahmedabad - 380058, Near Ambli ...",+(91)-79-33012959,http://www.anandniketan.org,1997,4.2,"Schools , Playgroups , ICSE Schools , International Schools , Kindergartens , Nursery Schools , Schools For Higher Secondary , Schools Nursery To X"
Brightstart Pre School,"B 26, Himmatlalpark Society, Satellite, Ahmedabad - 380015, Near Azad Society, Opposite Bimanagar",+(91)-79-33015840,http://www.thebrightstart.com,2008,4.6,"Schools , English Medium Schools , Playgroups , Gseb Schools , Nursery Schools , Kindergartens"
Shanti Asiatic School,"200 Feet Ring Road, Bopal, Ahmedabad - 380058, Opposite Vraj Gardens",+(91)-79-33212434,http://www.shantiasiatic.org,2000,4.1,"Schools , CBSE Schools , English Medium Schools"
Ruth Memorial School,"Vasna Barrage Road, Vasna, Ahmedabad - 380007",+(91)-79-30234390,,1981,4.0,"Schools , English Medium Schools , Gseb Schools , Nursery Schools , Kindergartens , Schools Nursery To X , Schools Nursery To VII"
S L English School,"C/O Shree Aval Education Trust, Madanpura Road, Ranip, Ahmedabad - 382480, Opposite Viswadip Society","+(91)-79-27523970 , +(91)-9033357451",,1999,5.0,"Schools , English Medium Schools , Playgroups , Gujarati Medium Schools , International Schools , Kindergartens , Schools For Higher Secondary , Public Schools , Schools Nursery To VII"
Euro Kids,"26, Goplani Tenament, Kubernagar, Ahmedabad - 382340, Opposite Tulsi Apartment",+(91)-79-30495150,http://www.eurokidsindia.com,2012,4.0,"Schools , Playgroups , Nursery Schools , Kindergartens"
Little Millennium,"21 A Vardhman Society, Sattadhar Crossing, Ghatlodia, Ahmedabad - 380061, Behind Kalasagar Mall",+(91)-79-33010631,http://www.littlemillennium.com,2014,5.0,"Schools , Playgroups , Summer Camps , Nursery Schools , Kindergartens , Mother Toddler Activity Centres"
Junior Genius Pre Primary School And Activity Centre,"C-77, Karmacharinagar Part 1, Ghatlodia, Ahmedabad - 380061, Near Ranna Park Prabhat Chowk, Nr Shash...",+(91)-79-30495571,http://www.juniorgenius.in,1991,3.8,"Schools , English Medium Schools , Playgroups , Day Care Centres , Nursery Schools , Kindergartens , Dermatoglyphics Multiple Intelligence Test Centres , Nursery Teacher Training Institutes"
Blooming Kidz Pre School,"15, Below Akanksha Appartment, Sola Road, Ghatlodia, Ahmedabad - 380061, Near Sola Crossing",+(91)-79-33013829,http://www.bloomingeducation.com,2010,4.5,"Schools , Playgroups , Nursery Schools , Kindergartens"
Eurokids,"1829, Sardar Nagar Main Road, Sardar Nagar, Ahmedabad - 382475, Near Sadarnagar Community Hall",+(91)-79-30925602,,2013,3.5,"Schools , Playgroups , Nursery Schools , Kindergartens"
EuroKids,"Crescent School, Sarkhej Road, Juhapura, Ahmedabad - 380055, Near Shahin Tiles Factory, Behind Amber...","+(91)-79-30234700 , 18002095656",http://www.eurokidsindia.com,2008,4.2,"Schools , Playgroups , Nursery Schools , Kindergartens"
EuroKids,"1, Namrata Park Society, Shahibaug, Ahmedabad - 380004, Opposite Samvid Apartments, Near Cantonment ...","+(91)-79-30234546 , 18002095656",http://www.eurokidsindia.com,2009,4.6,"Schools , Playgroups , Nursery Schools , Kindergartens"
Muktajivan English School,"Maninagar, Ahmedabad - 380008, Near Avkar Hall & Daxini Society, Under Daxini Bridge",+(91)-79-30491666,http://www.muktjivanschools.com,2005,3.7,"Schools , English Medium Schools , Gseb Schools , Kindergartens"
EuroKids,"3, Surya Narayan Bunglows, Science City Road, Sola Road, Ahmedabad - 380061, Near R K Royal Hall , O...","+(91)-79-30236976 , 18002095656",http://www.eurokidsindia.com,2008,3.7,"Schools , Playgroups , Nursery Schools , Kindergartens"
Euro Kids,"1, Income Tax Society, Gurukul Road, Gurukul, Ahmedabad - 380052, Near H B Kapadia School, Near Subh...","+(91)-79-33012240 , 18002095656",http://www.eurokidsindia.com,2006,3.8,"Schools , Playgroups , Nursery Schools , Kindergartens"
Sattvavikas School,"Sattvavikas School, Near Sindhu Bhavan, Thaltej, Ahmedabad - 380059, Thaltej",+(91)-79-30234385,http://www.sattvavikas.com,2003,3.8,"CBSE Schools , Schools , English Medium Schools , Gseb Schools , Nursery Schools , Kindergartens , Schools For Higher Secondary , Schools Nursery To X , School For Boys"
St Anns School,"185, Sterling City, Bopal, Ahmedabad - 380058, Opposite Neelkanth Orchid Flat",+(91)-79-30492176,http://www.stannsschool.in,2000,3.6,"CBSE Schools , Schools , English Medium Schools , Playgroups , Gseb Schools , Nursery Schools , Kindergartens , Schools For Higher Secondary , Public Schools , Schools Nursery To X , Schools Nursery To VII"
Shreeji Image Public School,"Swaminarayan Vidhyadham, Jashodanagar, Mahemadabad Highway, Hathijan, Ahmedabad - 382445",+(91)-79-30922631,http://www.shreeswaminrayanvidhyadh.org,2012,4.3,"CBSE Schools , Schools , English Medium Schools , Gseb Schools , Nursery Schools"
Little Wings A Child Care Initiative & Academy,"Ghuma Bopal Road, Bopal, Ahmedabad - 380058, Near Kabir Enclave",+(91)-79-33010628,http://ww.littlewings.net,2014,3.9,"Schools , Language Classes For English , Playgroups , Personality Development Institutes , Activity Class , Language Classes , Nursery Schools , Personality Development , Language Classes For English For Children , Institutes For Skill Development , Tutorials For English , Institutes For Self Development , Tutorials For KG"
Little Millennium,"15 16, Rameshwaram Row House, Bodakdev, Ahmedabad - 380054, Lane Of Hyderabadi Biryani Satelite",+(91)-79-30922714,http://www.littlemillennium.com,1996,5.0,"Schools , Playgroups , Day Care Centres , Kindergartens , Activity Class , Nursery Schools , Mother Toddler Activity Centres , Schools Nursery To X , Schools Nursery To VII , Summer Camps"
Eurokids,"8, Chandramauli Bunglow, Sona Cross Road, Chandkheda, Ahmedabad - 382424, Behind Sharan Residency, O...",+(91)-79-30234727,http://www.eurokidsindia.com,2006,3.6,"Schools , Playgroups , Nursery Schools , Kindergartens"
First Step Playgroup And Nursery,"15, Uttam Nagar, Maninagar, Ahmedabad - 380008, Opposite Surya City Flat, Behind Hira Bhai Tower",+(91)-79-33015050,http://www.firststepplaygroup.in,2007,5.0,"Schools , English Medium Schools , Playgroups , Kindergartens , Activity Class , Nursery Schools , Calligraphy Classes , Vedic Maths Training Centres , Abacus Institutes , Online Abacus Classes"
Euro Kids,"31, Mayurpankh Society, Pintoo Garments Lane, Manekbag, Ahmedabad - 380015, Opp. Shri Shriravishanka...",+(91)-79-30495452,,2002,4.2,"Schools , Playgroups , Nursery Schools , Kindergartens"
Hello Kids Nalanda,"A 14, C P Nagar Part 2, Ghatlodia, Ahmedabad - 380061, Opposite Arjun Tower",+(91)-79-33014907,http://www.hellokids.co.in,2014,5.0,"Schools , Dance Classes , English Medium Schools , Playgroups , Summer Camps , Nursery Schools , Arts & Crafts Classes , Hobby Classes , Kindergartens , Drawing Class , Arts & Crafts Classes For Children"
Bright School,"Mangal Vidyalay School Campus, Ellis Bridge, Ahmedabad - 380006, Near Mithakhali Bus Stop",+(91)-79-30491971,http://www.brightschool.in,,3.6,"Schools , Playgroups , English Medium Schools , Day Care Centres , Kindergartens , Nursery Schools"
Angel School,"100/1, Naresh Building, Maninagar, Ahmedabad - 380008, Opposite L G Hospital",+(91)-79-30932969,http://www.angelschool.co.in,1982,4.3,"Schools , English Medium Schools , Playgroups , Day Care Centres , Gujarati Medium Schools , Summer Camps , International Schools , Gseb Schools , Nursery Schools , Kindergartens , IGCSE Schools , Yoga Teacher Training Institutes , Teacher Training Institutes , Schools For Higher Secondary , Public Schools , Schools Nursery To X , Schools Nursery To VII"
Euro Kids,"1, Ashiana Bungalows Part 2, Premchand Nagar Road, Vastrapur, Ahmedabad - 380015, Opposite Judges Bu...",+(91)-79-30495451,,1961,4.2,"Schools , Playgroups , Kindergartens , Nursery Schools"
Muktajivan English School,"Maninagar, Ahmedabad - 380008, Near Avkar Hall & Daxini Society, Under Daxini Bridge",+(91)-79-30491666,http://www.muktjivanschools.com,2005,3.7,"Schools , English Medium Schools , Gseb Schools , Kindergartens"
Anand Niketan School,"Plot No 495, Thaltej Shilaj Road, Opposite Aryaman Bungalow, Shilaj, Ahmedabad - 380058, Near Ambli ...",+(91)-79-33012959,http://www.anandniketan.org,1997,4.2,"Schools , Playgroups , ICSE Schools , International Schools , Kindergartens , Nursery Schools , Schools For Higher Secondary , Schools Nursery To X"
Mother Teresa World School,"663, Ognej Circle, Vadsar, Sarkhej Gandhinagar Highway, Ahmedabad - 380055, Near Airforce Station",+(91)-79-30925850,http://www.motherteresaschools.in,2012,4.2,"Schools , Boarding Schools"
St Marys Higher Secondary School,"Gota Vadsar Road, Ognaj, Ahmedabad - 380060, Near Vasant Nagar & Ahmedabad Institute of Technology",+(91)-79-33013767,,2003,5.0,"Schools , Playgroups , English Medium Schools , Kindergartens , Gseb Schools , Nursery Schools , Schools For Higher Secondary , Schools Nursery To X , Schools Nursery To VII"
Euro Kids,"14, Dungarshree Nagar 1, Anjali Cross Road, Paldi, Ahmedabad - 380007, Near Sheth Hospital",+(91)-79-30495454,,2002,4.0,"Schools , Playgroups , Kindergartens , Nursery Schools"
St Anns School,"185, Sterling City, Bopal, Ahmedabad - 380058, Opposite Neelkanth Orchid Flat",+(91)-79-30492176,http://www.stannsschool.in,2000,3.6,"CBSE Schools , Schools , English Medium Schools , Playgroups , Gseb Schools , Nursery Schools , Kindergartens , Schools For Higher Secondary , Public Schools , Schools Nursery To X , Schools Nursery To VII"
R P Vasani International School,"Nikol Naroda Road, Nava Naroda, Ahmedabad - 382330, Behind Radheshyam Residency, Near Suyog 99, Oppo...",+(91)-79-33014932,http://www.rpvis.org,2014,4.3,"CBSE Schools , Schools , English Medium Schools , Nursery Schools , Kindergartens"
Euro Kids,"Plot No 1/A, Asha Society, Sanad Sarkhej Highway, Sanand Ho, Sanand - 382110, Near Police Station",+(91)-79-30925116,,2013,3.5,"Schools , Playgroups , Nursery Schools , Kindergartens"
Sattvavikas School,"Sattvavikas School, Near Sindhu Bhavan, Thaltej, Ahmedabad - 380059, Thaltej",+(91)-79-30234385,http://www.sattvavikas.com,2003,3.8,"CBSE Schools , Schools , English Medium Schools , Gseb Schools , Nursery Schools , Kindergartens , Schools For Higher Secondary , Schools Nursery To X , School For Boys"
Ankur Higher Secondary School,"ANKUR ENGLISH SCHOOL, KRISHNANAGAR, Krishna Nagar, Ahmedabad - 382345, NR. MARUTI PLAZA",+(91)-79-30492714,,1999,3.8,"Schools , English Medium Schools , Gujarati Medium Schools , Schools For Higher Secondary , Schools Nursery To X , Schools Nursery To VII"
EuroKids,"25, Ravish Bunglows, Thaltej Hebatpur Road, Thaltej, Ahmedabad - 380059, Opposite Mahila ITI College...","+(91)-79-30236357 , 18002095656",http://www.eurokidsindia.com,2006,3.5,"Schools , Playgroups , Nursery Schools , Kindergartens"
Brightstart Pre School,"B 26, Himmatlalpark Society, Satellite, Ahmedabad - 380015, Near Azad Society, Opposite Bimanagar",+(91)-79-33015840,http://www.thebrightstart.com,2008,4.6,"Schools , English Medium Schools , Playgroups , Gseb Schools , Nursery Schools , Kindergartens"
EuroKids,"3, Surya Narayan Bunglows, Science City Road, Sola Road, Ahmedabad - 380061, Near R K Royal Hall , O...","+(91)-79-30236976 , 18002095656",http://www.eurokidsindia.com,2008,3.7,"Schools , Playgroups , Nursery Schools , Kindergartens"
Little Wings A Child Care Initiative & Academy,"Ghuma Bopal Road, Bopal, Ahmedabad - 380058, Near Kabir Enclave",+(91)-79-33010628,http://ww.littlewings.net,2014,3.9,"Schools , Language Classes For English , Playgroups , Personality Development Institutes , Activity Class , Language Classes , Nursery Schools , Personality Development , Language Classes For English For Children , Institutes For Skill Development , Tutorials For English , Institutes For Self Development , Tutorials For KG"
Sunflower English And Hindi Medium School,"001,Samir Nagar, Rajendra park road,Nr.Bhikshuk gruh road, Odhav, Ahmedabad - 382120, Maheshwari nagar","+(91)-9898000654 , 9067220040 , +(91)-9067220040",,1996,4.5,Schools
Delhi Public School,"Bopal Square, Bopal, Ahmedabad - 380058, Near Bopal Railway Crossing","+(91)-2717-230521 , 230571 , 230240 , 325400 , 325516",http://www.calorxdps.org,,4.2,"Schools , CBSE Schools , Playgroups , English Medium Schools , Kindergartens"
ST Xaviers High School,"Loyola Hall, Naranpura, Ahmedabad - 380013, Near Darpan Six Roads","+(91)-79-27910400 , 27910510",http://www.loyolahallahd.com,,4.2,"Schools , English Medium Schools , Gujarati Medium Schools , Kindergartens , Gseb Schools"
Anand Niketan School,"Satellite, Ahmedabad - 380015, Behind Fun Republic Cinema, Near Asavari Towers, Off S G Road","+(91)-9737047616 , 9624000858 , 9737047601 , 9737047614 , 9737047667 , 9737047651",http://www.anandniketan.org,,3.9,"Schools , English Medium Schools , Playgroups , ICSE Schools , Nursery Schools , Kindergartens"
Prakash Higher Secondary School,"Bodakdev, Ahmedabad - 380054, Near Sandesh Press","+(91)-79-26840123 , 26858888",http://www.prakashcbseschool.in,,4.1,"Schools , CBSE Schools , English Medium Schools , Kindergartens"
Udgam School For Children,"Thaltej, Ahmedabad - 380054, Near Doordarshan Kendra, Opposite Sardar Patel Institute","+(91)-79-26850339 , +(91)-9925153153 , 9909915522 , 26850336",http://www.udgamschool.com,,4.1,"Schools , CBSE Schools , English Medium Schools"
St Kabir School,"Drive In Road, Ahmedabad - 380052, Near Goyal Intercity, Opposite Aditya Bunglows","+(91)-79-26858695 , 26855995",http://www.stkabir.com,,4.0,"CBSE Schools , Schools , English Medium Schools , Kindergartens , Nursery Schools"
Sheth C N Vidyalaya,"C N Vidyalaya, Doctor Vikram Sarabhai Road, Ambawadi, Ahmedabad - 380006","+(91)-79-26463696 , 26463511 , 26463566 , 26420637 , 26441473",http://www.cnvidyavihar.org,,4.2,"Schools , Computer Training Institutes , Institutes , Gujarati Medium Schools , Gseb Schools , Kindergartens , Fine Art Institutes , Technical Institutes , Computer Training Institutes For Doeacc"
H B Kapadia New High School,"Gurukul Road, Memnagar, Ahmedabad - 380052, Near Vishramnagar Road, Opposite Tirthnagar Part 1, Near...","+(91)-79-27414142 , +(91)-9558637777 , 9909222666 , 9537292999 , 27414140",http://www.hbkapadia.com,,4.1,"Schools , Playgroups , English Medium Schools , Gujarati Medium Schools , Kindergartens , Gseb Schools"
Hiramani School,"Hiramani School Campus, S G Highway, Gota Road, Ahmedabad - 382481, Opposite Nirma University","+(91)-79-242505 , 242606 , 241164 , 241186 , 241124 , 241125",http://www.hiramanischools.org,,4.1,"Schools , English Medium Schools , Gujarati Medium Schools , Gseb Schools , Hostel For Students , Nursery Schools , Kindergartens , Computer Training Diploma O Level"
Nirma Vidyavihar,"Plot No 390, Bodakdev, Ahmedabad - 380054, Beside Galaxy Tower, Near Grand Bhagwati Hotel","+(91)-79-26858901 , 26858902 , 65102000 , 65103000",http://www.nirmavidyavihar.co.in,,3.9,"CBSE Schools , Schools , English Medium Schools , Kindergartens"
Maharaja Agrasen Vidyalaya,"Memnagar, Ahmedabad - 380052, Opposite Gurukul, Near Sterling Hospital, Veer Savarkar Chowk","+(91)-79-27437440 , 27455271",http://www.agrasenvidyalaya.com,,4.0,"Schools , CBSE Schools , English Medium Schools , Kindergartens"
Shreyas Foundation,"Shreyas Tekra, Ambawadi, Ahmedabad - 380006, Near Manekbaug Hall, Near Shreyas Railway Over Bridge","+(91)-79-26601338 , 26601378 , 26601588",http://www.shreyasfoundation.in,,4.1,"Schools , English Medium Schools , Playgroups , Gujarati Medium Schools , Gseb Schools , Nursery Schools , Kindergartens"
Zydus School For Excellence,"Zydus Cadila School, Vejalpur, Ahmedabad - 380051, Near Alka Park Bus Stop, Jivraj Park","+(91)-79-26826799 , 26828294",http://www.zydusschool.org,,4.0,"Schools , English Medium Schools , ICSE Schools , Kindergartens"
DAV International School,"Off Pralahadnagar Corporate Road, Sarkhej Gandhinagar Highway, Ahmedabad - 380055, Ahead Of Vodafone...","+(91)-79-39815555 , 65432006",http://www.davahmedabad.net,,4.0,"CBSE Schools , Schools , Playgroups , English Medium Schools , Kindergartens , Nursery Schools"
Diwan Ballubhai School,"Paldi, Ahmedabad - 380007, Opposite Sanskar Kendra, Near Nid",+(91)-79-26587175,http://www.diwanballubhai.org,,4.1,"Schools , Gujarati Medium Schools , Gseb Schools"
Nirman High School,"Vastrapur, Ahmedabad - 380015, Near Vastrapur Lake, Opposite Shabri Apartments, Behind Indraprasth B...","+(91)-79-40027581 , 40027582",,,3.8,"Schools , CBSE Schools , English Medium Schools , Gujarati Medium Schools , Gseb Schools"
Sgvp International School,"Sharkhej Gandhinagar Highway, Gota Road, Ahmedabad - 382481, Near Sgvp Circle, Chharodi","+(91)-79-242138 , +(91)-9979880371 , 9879208511 , 242139",http://www.sgvp.org,,4.1,"Schools , English Medium Schools , Boarding Schools , ICSE Schools , International Schools , Kindergartens"
Ahmedabad International School,"Judges Bungalow Road, Bodakdev, Ahmedabad - 380054, Behind Kiran Motors, Opposite Rajpath Row House","+(91)-79-26872459 , 26871623",http://www.aischool.net,,4.2,"Schools , English Medium Schools , Kindergartens , Gseb Schools , IGCSE Schools"
Mount Carmel High School,"Shreyas Colony, Law Garden Road, Navrangpura, Ahmedabad - 380009",+(91)-79-26588360,http://www.mountcarmelahmedabad.com,,4.3,"Schools , English Medium Schools , Gseb Schools , Convent Schools"
Adani Vidya Mandir,"Vejalpur, Ahmedabad - 380051, Behind Adani CNG Pump, Beside Kataria Group, Off S G Highway, Makarba","+(91)-79-25557715 , 25557721 , 25557729 , 25557725",http://www.adanividyamandir.org,,4.0,"CBSE Schools , Schools , English Medium Schools"
Eklavya School,"Sarkhej Sanand Highway, Sanand Ho, Sanand - 382110, Near Sanathal Village",+(91)-2717-294227,http://www.eklavya.org,,4.1,"Schools , English Medium Schools , ICSE Schools , Kindergartens , Nursery Schools"
Udgam School For Children,"Jodhpur Cross Roads, Satellite, Ahmedabad - 380015, Near Ioc Petrol Pump","+(91)-79-26769595 , +(91)-9099902221 , 26850336",http://www.udgamschool.com,,4.2,"CBSE Schools , Schools , English Medium Schools , Kindergartens"
Zydus School For Excellence,"Bopal Sanand Road, Bopal, Ahmedabad - 380058, Near Village Godhavi","+(91)-8141015151 , 8141016161 , 8141019191",http://www.zydusschool.org,,4.1,"Schools , English Medium Schools , ICSE Schools , Kindergartens , Nursery Schools"
Shree Narayana Guru Vidyalaya,"Satellite, Ahmedabad - 380015, Opposite Isro, Ramdev Nagar, Jodhpur Tekra","+(91)-79-26861695 , 26860530 , 26860308",,,4.1,"Schools , CBSE Schools , English Medium Schools , Gujarati Medium Schools , Colleges , Commerce Colleges , Kindergartens , Gseb Schools , Colleges For Private MCom , B Com College Private"
St Kabir School,"Navrangpura, Ahmedabad - 380009, Behind H L College Of Commerce",+(91)-79-26461915,http://www.stkabir.com,,4.3,"Schools , English Medium Schools , Gseb Schools , Kindergartens , Nursery Schools"
A One School,"132 Feet Ring Road, Satellite, Ahmedabad - 380015, Near Ashwamegh, Opposite Jivandhara Party Plot, B...",+(91)-79-26741234,,,4.0,"Schools , Playgroups , English Medium Schools , Gujarati Medium Schools , Kindergartens , Gseb Schools"
Rachana School,"Shahibaug, Ahmedabad - 380004, Opposite Rita Park, Near Sujata Flats","+(91)-79-22867745 , 22865935",http://www.rachanaschool.com,,4.1,"Schools , CBSE Schools , English Medium Schools"
Kendriya Vidyalaya No 1,"M R Campus, Shahibaug, Ahmedabad - 380004, Near Police Commissioner Office",+(91)-79-25626493,http://www.kvshahibaug.org,,4.1,"Schools , CBSE Schools , English Medium Schools"
Asia English School,"Ground Floor, Sunrise Park, Drive In Road, Ahmedabad - 380052, Opposite Himalaya Mall, Opposite Driv...","+(91)-79-26856446 , 26856447 , 26856449",http://www.asiaenglishschool.net,,4.1,"Schools , CBSE Schools , English Medium Schools , Kindergartens , Nursery Schools"
Seventh  Day Adventist Higher Secondary School,"132 Feet Ring Road, Maninagar, Ahmedabad - 380008, Near Haripura","+(91)-79-25861452 , +(91)-7802947276 , 9974423645",http://www.sdaschoolahmedabad.org,,4.3,"Schools , English Medium Schools , Playgroups , ICSE Schools , Nursery Schools , Kindergartens , Public Schools , Schools For Higher Secondary , Schools Nursery To VII , School For Boys"
The New Tulip International School,"Sterling City, Bopal, Ahmedabad - 380058","+(91)-2717-231959 , +(91)-9909979079 , 9824228623 , 9909979076 , 9909979089 , 329210 , 235095",http://www.thetulipschool.com,,4.2,"Schools , CBSE Schools , English Medium Schools , ICSE Schools , Kindergartens , IGCSE Schools"
Gujarat Law Society,"Ellis Bridge, Ahmedabad - 380006, Opposite Law Garden","+(91)-79-26440532 , 26468513 , 26440547",http://www.gujaratlawsociety.org,,4.1,"Schools , Computer Training Institutes , English Medium Schools , Playgroups , Gujarati Medium Schools , Law Colleges , Nursery Schools , Kindergartens , Computer Training Institutes For Doeacc , MCSE Training Institutes , Computer Training Institutes For Novell Netware , Computer Training Institutes For MS Windows , Computer Training Institutes For Windows Nt , Computer Training Institutes For Oracle Financial"
Kameshwar Vidyalaya,"100 Feet Ring Road, Jodhpur Cross Road, Satellite, Ahmedabad - 380015, Near Mansi Circle","+(91)-79-26741136 , +(91)-8980022555",http://www.nishkal.org,,4.0,"Schools , English Medium Schools , Gujarati Medium Schools , Gseb Schools"
Anand Niketan School,"Sindhu Bhavan Road, Bodakdev, Ahmedabad - 380054, Opposite Sindhu Bhavan, Off S G Road",+(91)-9737047653,http://www.anandniketan.org,,4.0,"Schools , English Medium Schools , ICSE Schools , Kindergartens , Nursery Schools"
DPS East School,"Hathijan, Ahmedabad - 382445, Opposite Punit Ashram, Near Nelson School","+(91)-79-25471117 , +(91)-8155013364",http://www.cprs.calorx.org,,4.0,"CBSE Schools , Schools , English Medium Schools , Playgroups , Gseb Schools , Nursery Schools , Kindergartens"
St Kabir School,"Naranpura, Ahmedabad - 380013, Behind Loyola Hall, Near Vasu Pujya Apartment",+(91)-79-27910216,http://www.stkabir.com,,4.1,"Schools , English Medium Schools , Gseb Schools , Kindergartens , Nursery Schools"
Amrut School,"15, Cantonment, Shahibaug, Ahmedabad - 380004, Near Camp Hanuman","+(91)-79-22866393 , 22866501 , 22864144 , 22864145",http://www.amrutschool.edu.in,,4.2,"CBSE Schools , Schools , English Medium Schools , Gseb Schools , Nursery Schools , Kindergartens"
Podar International School,"New C G Road, Chandkheda, Ahmedabad - 382424, Behind Vitthal Complex, Opposite Sakaar School, Near T...","+(91)-79-23972774 , +(91)-7574807007 , 23972894 , 18001038866",http://www.podar.org,,4.1,"Schools , CBSE Schools , English Medium Schools , Nursery Schools"
Doon International Public School,"Jaihind School Campus, Maninagar, Ahmedabad - 380008, Near Jawahar Chowk","+(91)-79-25471533 , 25450300",,,4.4,"Schools , English Medium Schools , Kindergartens , Gseb Schools"
H B Kapadia New High School,"Shoppers Plaza, Sardar Patel Ring Road, Chandkheda, Ahmedabad - 382424, Behind Parshwanath Metro City","+(91)-9033424243 , 9537198986",http://www.hbkapadia.com,,4.2,"Schools , Playgroups , English Medium Schools , Gujarati Medium Schools , Kindergartens , Gseb Schools"
JG International School,"Jg Campus Of Excellence, Sola Road, Ahmedabad - 380061, Opposite Gulab Tower, Off Sola Road","+(91)-79-27492315 , +(91)-9724689345 , 27499315 , 65416438 , 65411315 , 65412315",http://www.jgcampusindia.com,,3.4,"Schools , English Medium Schools , ICSE Schools , Nursery Schools , Kindergartens , IGCSE Schools"
ST Xaviers School,"Hansol, Ahmedabad - 382475, Near Indira Bridge, Near Sardarnagar","+(91)-79-22869727 , +(91)-9712397131",,,3.9,"Schools , English Medium Schools , Gujarati Medium Schools , Gseb Schools"
Kendriya Vidyalaya,"Isro Colony, Vastrapur, Ahmedabad - 380015, Near Blind School","+(91)-79-26309021 , +(91)-9429208374 , 26304694",http://www.kvsac.org,,4.0,"Schools , CBSE Schools , English Medium Schools"
